{
  "ir_version": "0.1",
  "relationships": [
    {
      "from": "blk_0003_7c3fbb79372a",
      "to": "blk_0002_e846ad8f44e1",
      "type": "QUALIFIES"
    },
    {
      "from": "blk_0003_7c3fbb79372a",
      "to": "blk_0002_e846ad8f44e1",
      "type": "SUPPORTS"
    }
  ],
  "restoration": {
    "budget": 8,
    "reason": "",
    "restored": []
  },
  "schema_version": "context-ir/0.1",
  "selection": {
    "dropped": [
      "blk_0004_a112b0327c75"
    ],
    "kept": [
      "blk_0001_e4954dfda8f4",
      "blk_0002_e846ad8f44e1",
      "blk_0003_7c3fbb79372a",
      "blk_0005_84d74d140ca7"
    ],
    "policy": "relevance-compaction-1.2",
    "rationale": {
      "blk_0001_e4954dfda8f4": "short_block",
      "blk_0002_e846ad8f44e1": "lexical_overlap",
      "blk_0003_7c3fbb79372a": "lexical_overlap",
      "blk_0004_a112b0327c75": "no_lexical_overlap",
      "blk_0005_84d74d140ca7": "lexical_overlap"
    },
    "trimmed": []
  },
  "sufficiency": {
    "confidence": 1.0,
    "missing_evidence": [],
    "sufficient": true
  },
  "task_id": "lcc-333515ab0849",
  "units": [
    {
      "content": "Mobile booking friction evidence\n",
      "id": "blk_0001_e4954dfda8f4",
      "necessity": "UNKNOWN",
      "protected": true,
      "provenance": {
        "collected_at": "2026-10-02T00:00:00Z",
        "origin": "corpus-04.txt",
        "transform": "none"
      },
      "relevance": 1.0,
      "source": "corpus-04.txt:1-1"
    },
    {
      "content": "The mobile booking flow loses users at the payment confirmation screen during checkout on slow connections.\n",
      "id": "blk_0002_e846ad8f44e1",
      "necessity": "UNKNOWN",
      "protected": false,
      "provenance": {
        "collected_at": "2026-10-02T00:00:00Z",
        "origin": "corpus-04.txt",
        "transform": "none"
      },
      "relevance": 0.67,
      "source": "corpus-04.txt:3-3"
    },
    {
      "content": "However, the payment confirmation screen behaves differently for users with saved profiles, and the profile shortcut hides the real bottleneck in the booking flow analysis.\n",
      "id": "blk_0003_7c3fbb79372a",
      "necessity": "UNKNOWN",
      "protected": false,
      "provenance": {
        "collected_at": "2026-10-02T00:00:00Z",
        "origin": "corpus-04.txt",
        "transform": "none"
      },
      "relationships": [
        {
          "to": "blk_0002_e846ad8f44e1",
          "type": "QUALIFIES"
        },
        {
          "to": "blk_0002_e846ad8f44e1",
          "type": "SUPPORTS"
        }
      ],
      "relevance": 0.33,
      "source": "corpus-04.txt:5-5"
    },
    {
      "content": "The office plants need watering on fridays and the kitchen runs out of coffee beans every week.\n",
      "id": "blk_0004_a112b0327c75",
      "necessity": "UNKNOWN",
      "protected": false,
      "provenance": {
        "collected_at": "2026-10-02T00:00:00Z",
        "origin": "corpus-04.txt",
        "transform": "none"
      },
      "relevance": 0.0,
      "source": "corpus-04.txt:7-7"
    },
    {
      "content": "Checkout completion improves when the mobile booking flow keeps the payment step under three screens total.\n",
      "id": "blk_0005_84d74d140ca7",
      "necessity": "UNKNOWN",
      "protected": false,
      "provenance": {
        "collected_at": "2026-10-02T00:00:00Z",
        "origin": "corpus-04.txt",
        "transform": "none"
      },
      "relevance": 0.67,
      "source": "corpus-04.txt:9-9"
    }
  ]
}
