{
  "ir_version": "0.1",
  "relationships": [
    {
      "from": "blk_0007_9529389a9ac3",
      "to": "blk_0002_9c53bf3905c4",
      "type": "SUPPORTS"
    }
  ],
  "restoration": {
    "budget": 8,
    "reason": "",
    "restored": []
  },
  "schema_version": "context-ir/0.1",
  "selection": {
    "dropped": [
      "blk_0005_b1a0f9345438",
      "blk_0006_c029baac28cf"
    ],
    "kept": [
      "blk_0001_89d128e99cee",
      "blk_0002_9c53bf3905c4",
      "blk_0003_4a32b678a3b6",
      "blk_0004_26fca06e6b23",
      "blk_0007_9529389a9ac3",
      "blk_0008_082e34cdaee3"
    ],
    "policy": "relevance-compaction-1.2",
    "rationale": {
      "blk_0001_89d128e99cee": "short_block",
      "blk_0002_9c53bf3905c4": "lexical_overlap",
      "blk_0003_4a32b678a3b6": "lexical_overlap",
      "blk_0004_26fca06e6b23": "lexical_overlap",
      "blk_0005_b1a0f9345438": "no_lexical_overlap",
      "blk_0006_c029baac28cf": "no_lexical_overlap",
      "blk_0007_9529389a9ac3": "lexical_overlap",
      "blk_0008_082e34cdaee3": "lexical_overlap"
    },
    "trimmed": []
  },
  "sufficiency": {
    "confidence": 1.0,
    "missing_evidence": [],
    "sufficient": true
  },
  "task_id": "lcc-333515ab0849",
  "units": [
    {
      "content": "Mobile booking friction report\n",
      "id": "blk_0001_89d128e99cee",
      "necessity": "UNKNOWN",
      "protected": true,
      "provenance": {
        "collected_at": "2026-10-02T00:00:00Z",
        "origin": "corpus-01.txt",
        "transform": "none"
      },
      "relevance": 1.0,
      "source": "corpus-01.txt:1-1"
    },
    {
      "content": "Users report that the mobile checkout flow has too many steps before payment reaches the confirmation screen on slow connections.\n",
      "id": "blk_0002_9c53bf3905c4",
      "necessity": "UNKNOWN",
      "protected": false,
      "provenance": {
        "collected_at": "2026-10-02T00:00:00Z",
        "origin": "corpus-01.txt",
        "transform": "none"
      },
      "relevance": 0.5,
      "source": "corpus-01.txt:3-3"
    },
    {
      "content": "The payment form asks for the billing address even when it matches the address already stored in the user profile for mobile checkout.\n",
      "id": "blk_0003_4a32b678a3b6",
      "necessity": "UNKNOWN",
      "protected": false,
      "provenance": {
        "collected_at": "2026-10-02T00:00:00Z",
        "origin": "corpus-01.txt",
        "transform": "none"
      },
      "relevance": 0.33,
      "source": "corpus-01.txt:5-5"
    },
    {
      "content": "Recommendation: remove the redundant address fields from the mobile payment step to reduce friction in the checkout flow.\n",
      "id": "blk_0004_26fca06e6b23",
      "necessity": "UNKNOWN",
      "protected": false,
      "provenance": {
        "collected_at": "2026-10-02T00:00:00Z",
        "origin": "corpus-01.txt",
        "transform": "none"
      },
      "relevance": 0.83,
      "source": "corpus-01.txt:7-7"
    },
    {
      "content": "Server migration notes: postgres indexes will rebuild on sunday during the scheduled downtime window tonight.\n",
      "id": "blk_0005_b1a0f9345438",
      "necessity": "UNKNOWN",
      "protected": false,
      "provenance": {
        "collected_at": "2026-10-02T00:00:00Z",
        "origin": "corpus-01.txt",
        "transform": "none"
      },
      "relevance": 0.0,
      "source": "corpus-01.txt:9-9"
    },
    {
      "content": "Unrelated chatter: the office party is on friday, bring snacks and drinks for everyone attending the celebration.\n",
      "id": "blk_0006_c029baac28cf",
      "necessity": "UNKNOWN",
      "protected": false,
      "provenance": {
        "collected_at": "2026-10-02T00:00:00Z",
        "origin": "corpus-01.txt",
        "transform": "none"
      },
      "relevance": 0.0,
      "source": "corpus-01.txt:11-11"
    },
    {
      "content": "Analytics show that forty percent of mobile users abandon the checkout at the payment confirmation screen every week.\n",
      "id": "blk_0007_9529389a9ac3",
      "necessity": "UNKNOWN",
      "protected": false,
      "provenance": {
        "collected_at": "2026-10-02T00:00:00Z",
        "origin": "corpus-01.txt",
        "transform": "none"
      },
      "relationships": [
        {
          "to": "blk_0002_9c53bf3905c4",
          "type": "SUPPORTS"
        }
      ],
      "relevance": 0.33,
      "source": "corpus-01.txt:13-13"
    },
    {
      "content": "Streamlining the payment form should reduce mobile booking friction and improve the conversion rate of the checkout.\n",
      "id": "blk_0008_082e34cdaee3",
      "necessity": "UNKNOWN",
      "protected": false,
      "provenance": {
        "collected_at": "2026-10-02T00:00:00Z",
        "origin": "corpus-01.txt",
        "transform": "none"
      },
      "relevance": 0.83,
      "source": "corpus-01.txt:15-15"
    }
  ]
}
